<?xml version="1.0" encoding="UTF-8"?>

<!-- winter2016-day.xml
     Simon Su, Mark Khauv -->

<!DOCTYPE day SYSTEM 'schedule.dtd'>

<day>
    <dayz weekday="Monday">
        <dayBooking>
            <timeStart>1030</timeStart>
            <timeEnd>1220</timeEnd>
            <courseName>Content Management Systems Admin Lab</courseName>
            <room>SE12-306</room>
            <instructor>Medhat Elmasry</instructor>
        </dayBooking>
        
        <dayBooking>
            <timeStart>1630</timeStart>
            <timeEnd>1720</timeEnd>
            <courseName>Content Mananagement Systems Admin Lecture</courseName>
            <room>SE6-205</room>
            <instructor>Medhat Elmasry</instructor>
        </dayBooking>
    </dayz>
    
    <dayz weekday="Tuesday">
        <dayBooking>
            <timeStart>830</timeStart>
            <timeEnd>1020</timeEnd>
            <courseName>Enterprise Systems Admin Lab</courseName>
            <room>SE12-306</room>
            <instructor>Bethany Edmunds</instructor>
        </dayBooking>
        
        <dayBooking>
            <timeStart>1230</timeStart>
            <timeEnd>1320</timeEnd>
            <courseName>Content Management Systems Admin Lecture</courseName>
            <room>SW9-206</room>
            <instructor>Medhat Elmasry</instructor>
        </dayBooking>
        
        <dayBooking>
            <timeStart>1530</timeStart>
            <timeEnd>1720</timeEnd>
            <courseName>Enterprise Systems Admin Lecture</courseName>
            <room>SW3-3615</room>
            <instructor>Bethany Edmunds</instructor>
        </dayBooking>
    </dayz>
    
    <dayz weekday="Wednesday">
        <dayBooking>
            <timeStart>1230</timeStart>
            <timeEnd>1420</timeEnd>
            <courseName>Integrative Programming and Technologies Lecture</courseName>
            <room>SW3-1750</room>
            <instructor>James Parry</instructor>
        </dayBooking>
    </dayz>
    
    <dayz weekday="Thursday">
        <dayBooking>
            <timeStart>1330</timeStart>
            <timeEnd>1520</timeEnd>
            <courseName>Integrative Programming and Technologies Lab</courseName>
            <room>SE12-306</room>
            <instructor>James Parry</instructor>
        </dayBooking>
    </dayz>
</day>
