<?xml version="1.0" encoding="UTF-8"?>

<!-- winter2016-course.xml
     Simon Su, Mark Khauv -->

<!DOCTYPE course SYSTEM 'schedule.dtd'>

<course>
    <aCourse code="ACIT4620" name="Enterprise Systems Administration">
        <courseBooking type="Lecture">
            <daySlot>Monday</daySlot>
            <timeStart>1230</timeStart>
            <timeEnd>1320</timeEnd>
            <room>SW1-2009</room>
            <instructor>Bethany Edmunds</instructor>
        </courseBooking>
        <courseBooking type="Lab">
            <daySlot>Tuesday</daySlot>
            <timeStart>0830</timeStart>
            <timeEnd>1020</timeEnd>
            <room>SE12-306</room>
            <instructor>Bethany Edmunds</instructor>
        </courseBooking>
        <courseBooking type="Lecture">
            <daySlot>Tuesday</daySlot>
            <timeStart>1530</timeStart>
            <timeEnd>1620</timeEnd>
            <room>SW3-3615</room>
            <instructor>Bethany Edmunds</instructor>
        </courseBooking>
    </aCourse>
    
    <aCourse code="ACIT4650" name="Content Management Systems Administration">
        <courseBooking type="Lab">
            <daySlot>Monday</daySlot>
            <timeStart>1030</timeStart>
            <timeEnd>1220</timeEnd>
            <room>SE12-306</room>
            <instructor>Medhat Elmasry</instructor> 
        </courseBooking>
        <courseBooking type="Lecture">
            <daySlot>Monday</daySlot>
            <timeStart>1630</timeStart>
            <timeEnd>1720</timeEnd>
            <room>SE6-205</room>
            <instructor>Medhat Elmasry</instructor>
        </courseBooking>
        <courseBooking type="Lecture">
            <daySlot>Tuesday</daySlot>
            <timeStart>1230</timeStart>
            <timeEnd>1320</timeEnd>
            <room>SW9-206</room>
            <instructor>Medhat Elmasry</instructor>
        </courseBooking>
    </aCourse>
    
    <aCourse code="ACIT4850" name="Integrative Programming and Technologies">
        <courseBooking type="Lecture">
            <daySlot>Wednesday</daySlot>
            <timeStart>1230</timeStart>
            <timeEnd>1420</timeEnd>
            <room>SW3-1750</room>
            <instructor>James Parry</instructor>
        </courseBooking>
        <courseBooking type="Lab">
            <daySlot>Thursday</daySlot>
            <timeStart>1330</timeStart>
            <timeEnd>1520</timeEnd>
            <room>SE12-308</room>
            <instructor>James Parry</instructor>
        </courseBooking>
    </aCourse>
</course>
