<?xml version="1.0" encoding="UTF-8"?>
<!--
To change this license header, choose License Headers in Project Properties.
To change this template file, choose Tools | Templates
and open the template in the editor.
-->

<!DOCTYPE time SYSTEM 'schedule.dtd'>

<time>
    <timeslot duration="2" start="830" end="1020">
    <timeBooking>
        <daySlot>Tuesday</daySlot>
        <courseName>Enterprise Systems Admin Lab</courseName>
        <room>SE12-306</room>
        <instructor>Bethany Edmunds</instructor>
    </timeBooking>
    </timeslot>
    
    <timeslot duration="2" start="1030" end="1220"> 
    <timeBooking> 
        <daySlot>Monday</daySlot>
        <courseName>Content Management Systems Admin Lab</courseName>
        <room>SE12-306</room>
        <instructor>Medhat Elmasry</instructor>
    </timeBooking>
    </timeslot>
    
    <timeslot duration="1" start="1230" end="1320"> 
    <timeBooking>
        <daySlot>Monday</daySlot>
        <courseName>Enterprise Systems Admin Lecture</courseName>
        <room>SW1-2009</room>
        <instructor>Bethany Edmunds</instructor>
        
        <daySlot>Tuesday</daySlot>
        <courseName>Content Management Systems Admin Lecture</courseName>
        <room>SW9-206</room>
        <instructor>Medhat Elmasry</instructor>
    </timeBooking>
    </timeslot>
    
    <timeslot duration="2" start="1230" end="1420"> 
    <timeBooking>
        <daySlot>Wednesday</daySlot>
        <courseName>Integrative Programming and Technologies Lecture</courseName>
        <room>SW3-1750</room>
        <instructor>James Parry</instructor>
    </timeBooking>
    </timeslot>
    
    <timeslot duration="2" start="1330" end="1520"> 
    <timeBooking> 
        <daySlot>Thursday</daySlot>
        <courseName>Integrative Programming and Technologies Lab</courseName>
        <room>SE12-308</room>
        <instructor>James Parry</instructor>
    </timeBooking>
    </timeslot>
    
    <timeslot duration="1" start="1530" end="1620"> 
    <timeBooking>
        <daySlot>Tuesday</daySlot>
        <courseName>Enterprise Systems Admin Lecture</courseName>
        <room>SW3-3615</room>
        <instructor>Bethany Edmunds</instructor>
    </timeBooking>
    </timeslot>
    
    <timeslot duration="1" start="1630" end="1720"> 
    <timeBooking>
        <daySlot>Monday</daySlot>
        <courseName>Content Management Systems Admin Lecture</courseName>
        <room>SE6-205</room>
        <instructor>Medhat Elmasry</instructor>
    </timeBooking>
    </timeslot>
</time>
